{"bindings":[{"capabilityId":"org.alica.consumer","consumerId":"org.alica.client","descriptorDigest":"sha256:0ef2f30880956bd7e5d2bbab948573d55bd9d756170881193f25259c0c8fd000","packageDigest":"sha256:a0f8143f73812f9f9fc7f8d0856523397a4c3fdb77b0e74a35bfd8b1313aab75","providerId":"org.alica.consumer","providerVersion":"1.0.0","scope":"root","version":"1.0.0"},{"capabilityId":"org.alica.echo","consumerId":"org.alica.consumer","descriptorDigest":"sha256:58ee9f01fb4948faf71ed7a3468d55563f3117faccecb8a3b1ebc81ff0aee649","packageDigest":"sha256:bbbfe40e40f220301de43bcb18edd7c85e0e85162176dde109363ed869fff356","providerId":"org.alica.echoa","providerVersion":"1.0.0","scope":"root","version":"1.0.0"}],"plugins":[{"id":"org.alica.client","packageDigest":"sha256:69bfa3ce25fe967bbfa054888d22f42a2a2aa958d77138d84c54ebeda05279bd","version":"1.0.0"},{"id":"org.alica.consumer","packageDigest":"sha256:a0f8143f73812f9f9fc7f8d0856523397a4c3fdb77b0e74a35bfd8b1313aab75","version":"1.0.0"},{"id":"org.alica.echoa","packageDigest":"sha256:bbbfe40e40f220301de43bcb18edd7c85e0e85162176dde109363ed869fff356","version":"1.0.0"}],"policyDigest":"sha256:3b35926e3c4752903a85c8e9e1557d6f0a92ff1ef2b7528ac1ced566bd6af631","profileDigest":"sha256:a48428faaf22d426078feb215a2adde17e7aa1d6de9b4290fb9c297cf10f654a","schemaVersion":"alica.resolution-lock/v1"}