{"bindings":[{"capabilityId":"org.alica.consumer","consumerId":"org.alica.client","descriptorDigest":"sha256:0ef2f30880956bd7e5d2bbab948573d55bd9d756170881193f25259c0c8fd000","packageDigest":"sha256:a0f8143f73812f9f9fc7f8d0856523397a4c3fdb77b0e74a35bfd8b1313aab75","providerId":"org.alica.consumer","providerVersion":"1.0.0","scope":"root","version":"1.0.0"},{"capabilityId":"org.alica.echo","consumerId":"org.alica.consumer","descriptorDigest":"sha256:58ee9f01fb4948faf71ed7a3468d55563f3117faccecb8a3b1ebc81ff0aee649","packageDigest":"sha256:81bc60299f2492a0408916b63c5f651c2a016f95f48468850d0c38fbe0e31c15","providerId":"org.alica.echoa","providerVersion":"1.1.0","scope":"root","version":"1.0.0"}],"plugins":[{"id":"org.alica.client","packageDigest":"sha256:69bfa3ce25fe967bbfa054888d22f42a2a2aa958d77138d84c54ebeda05279bd","version":"1.0.0"},{"id":"org.alica.consumer","packageDigest":"sha256:a0f8143f73812f9f9fc7f8d0856523397a4c3fdb77b0e74a35bfd8b1313aab75","version":"1.0.0"},{"id":"org.alica.echoa","packageDigest":"sha256:81bc60299f2492a0408916b63c5f651c2a016f95f48468850d0c38fbe0e31c15","version":"1.1.0"}],"policyDigest":"sha256:1c868718f59be02040d8bd6c428121dd27da2634dba88235735d8be459b20982","profileDigest":"sha256:3c949687a1aea06b06880d4ed6e2caa67235ff40da192d790001f22fa04fd530","schemaVersion":"alica.resolution-lock/v1"}